{
  "schema_version": "1.0.0",
  "document_id": "SYNTHETIC-KZH-RD-001",
  "project_id": "SYNTHETIC-RESIDENTIAL-DEMO",
  "stage": "РД",
  "discipline": "КЖ",
  "section_code": "КЖ",
  "revision": "R1",
  "basis": {
    "document_id": "SYNTHETIC-KZH-PD-001",
    "revision": "P0"
  },
  "values": [
    {
      "key": "concrete.class",
      "value": "B30",
      "target_ref": "CONCRETE-01",
      "source_ref": "RD-KZH general notes",
      "problem_zone": { "sheet_id": "RD-KZH-101", "page_number": 1 }
    },
    {
      "key": "защитный.слой",
      "value": 0.025,
      "unit": "m",
      "target_ref": "REBAR-01",
      "source_ref": "RD-KZH rebar spec"
    },
    {
      "key": "slab.thickness",
      "value": 250,
      "unit": "mm",
      "target_ref": "SLAB-01",
      "source_ref": "RD-KZH slab schedule",
      "problem_zone": {
        "sheet_id": "RD-KZH-102",
        "page_number": 2,
        "x": 40,
        "y": 60,
        "width": 120,
        "height": 30
      }
    },
    {
      "key": "rebar.grade",
      "value": "A500C",
      "target_ref": "REBAR-01",
      "source_ref": "RD-KZH rebar spec"
    }
  ]
}
